{
  "$schema": "https://json-schema.org/draft/2020-12/schema",
  "$id": "https://zentinel.dev/schemas/pipeline.handoff.v1.schema.json",
  "title": "zentinel pipeline handoff v1",
  "type": "object",
  "additionalProperties": false,
  "required": [
    "schema_version",
    "task_id",
    "role",
    "status",
    "files_changed",
    "tests_added",
    "commands_executed",
    "artifacts_produced",
    "known_risks",
    "assumptions",
    "mutation_results",
    "property_results",
    "doctest_results",
    "next_step_instructions"
  ],
  "properties": {
    "schema_version": { "const": "zentinel.pipeline.handoff.v1" },
    "task_id": { "type": "string", "pattern": "^[0-9]{3}$" },
    "role": { "type": "string", "minLength": 1 },
    "status": { "enum": ["passed", "failed", "blocked", "needs_review", "not_applicable"] },
    "files_changed": { "type": "array", "items": { "type": "string" } },
    "tests_added": { "type": "array", "items": { "type": "string" } },
    "commands_executed": {
      "type": "array",
      "items": {
        "type": "object",
        "additionalProperties": false,
        "required": ["command", "status"],
        "properties": {
          "command": { "type": "string" },
          "status": { "enum": ["passed", "failed", "skipped"] },
          "exit_code": { "type": ["integer", "null"] },
          "summary": { "type": "string" }
        }
      }
    },
    "artifacts_produced": { "type": "array", "items": { "type": "string" } },
    "known_risks": { "type": "array", "items": { "type": "string" } },
    "assumptions": { "type": "array", "items": { "type": "string" } },
    "mutation_results": { "type": ["object", "null"] },
    "property_results": { "type": ["object", "null"] },
    "doctest_results": { "type": ["object", "null"] },
    "next_step_instructions": { "type": "string", "minLength": 1 }
  }
}
