{
  "schema_version": "zentinel.pipeline.handoff.v1",
  "task_id": "043",
  "role": "Mutation Agent",
  "status": "passed",
  "files_changed": [],
  "tests_added": [],
  "commands_executed": [
    {
      "command": "zentinel run --operator comparison_boundary",
      "status": "passed"
    }
  ],
  "artifacts_produced": [
    "artifacts/pipeline/043/mutation/report.json"
  ],
  "known_risks": [],
  "assumptions": [],
  "mutation_results": {
    "killed": 12,
    "survived": 0,
    "invalid": 0
  },
  "property_results": null,
  "doctest_results": null,
  "next_step_instructions": "Proceed to final verifier."
}
